{
  "active_parameter_count": "unsupported",
  "architecture": null,
  "artifact_digest": "sha256:a1a1a1a1a1a1a1a1a1a1a1a1a1a1a1a1a1a1a1a1a1a1a1a1a1a1a1a1a1a1a1a1",
  "attention_heads": "unsupported",
  "canonical_id": "llamacpp/gemma-3-12b-it-Q4_K_M.gguf@sha256:a1a1a1a1a1a1",
  "declared_capabilities": [],
  "embedding_dim": "unsupported",
  "expert_count": "unsupported",
  "family": null,
  "head_dim": "unsupported",
  "identity_confidence": "digest",
  "kv_heads": "unsupported",
  "layers": "unsupported",
  "license_text": null,
  "max_context": "unsupported",
  "observed_at": "2026-08-21T09:14:02.318Z",
  "parameter_count": "unsupported",
  "provider_kind": "llamacpp",
  "provider_model_name": "gemma-3-12b-it-Q4_K_M.gguf",
  "quantization": null,
  "rope_config": null,
  "size_bytes": "unsupported",
  "sliding_window": "unsupported",
  "vocab_size": "unsupported",
  "weight_format": null
}
